{
  "packageVersion": "1.3.1",
  "nodeVersion": "22.0.0",
  "operatingSystem": "Windows",
  "codexHomeDetected": true,
  "authenticationFound": true,
  "localUsageFound": true,
  "liveEndpoint": "reachable",
  "agentIntegrations": {
    "opencode": "installed",
    "pi": "installed",
    "copilot": "installed"
  }
}
